{
  "$schema": "https://raw.githubusercontent.com/sirashton/mvplanner/main/plan.schema.json",
  "version": 2,
  "revision": 120,
  "nextId": 67,
  "root": {
    "id": "T-1",
    "name": "MVPlanner",
    "status": "In Progress",
    "mscw": "Must",
    "description": "One prioritised plan that humans and agent swarms work from, so agents stop drifting from what was agreed.",
    "subtasks": [
      {
        "id": "T-2",
        "name": "Core library",
        "status": "In Progress",
        "mscw": "Must",
        "description": "Plan schema, do-more rollup, critical path and markers, shared by every tool.",
        "subtasks": [
          {
            "id": "T-3",
            "name": "Schema v2 with stable ids and migration from v1",
            "status": "Complete",
            "mscw": "Must",
            "acceptance": [
              {
                "text": "Every task has a T-n id",
                "done": true
              },
              {
                "text": "A v1 plan.json migrates without losing tasks",
                "done": true
              }
            ]
          },
          {
            "id": "T-4",
            "name": "Do-more rollup and critical path outside the webview",
            "status": "Complete",
            "mscw": "Must"
          },
          {
            "id": "T-5",
            "name": "Deferral markers: MVP(id) and TODO(id)",
            "status": "Complete",
            "mscw": "Must"
          },
          {
            "id": "T-6",
            "name": "Settle how a parent's own status relates to its subtasks",
            "status": "Not Started",
            "mscw": "Should",
            "description": "Today a parent's status is ignored unless all its subtasks are deferrals or proposals."
          }
        ]
      },
      {
        "id": "T-7",
        "name": "Shared storage",
        "status": "In Progress",
        "mscw": "Must",
        "subtasks": [
          {
            "id": "T-8",
            "name": "Plan branch on GitHub with fetch, push and retry",
            "status": "Complete",
            "mscw": "Must",
            "acceptance": [
              {
                "text": "Two clones writing at once both land",
                "done": true
              },
              {
                "text": "The working tree is never touched",
                "done": true
              }
            ]
          },
          {
            "id": "T-9",
            "name": "Single plan file in the main checkout",
            "status": "Complete",
            "mscw": "Should"
          },
          {
            "id": "T-10",
            "name": "Hosted MVPlanner service",
            "status": "Not Started",
            "mscw": "Should",
            "description": "A remote MCP server for instant claims and plans spanning several repos.",
            "log": [
              {
                "at": "2026-10-22T22:44:17.163Z",
                "agent": "claude-pr4",
                "text": "priority Could -> Should; Alex: hosted web UI may also help cross-project coordination"
              }
            ]
          }
        ]
      },
      {
        "id": "T-11",
        "name": "Agent tools",
        "status": "Complete",
        "mscw": "Must",
        "subtasks": [
          {
            "id": "T-12",
            "name": "mvplan CLI",
            "status": "Complete",
            "mscw": "Must"
          },
          {
            "id": "T-13",
            "name": "MCP server",
            "status": "Complete",
            "mscw": "Must"
          }
        ]
      },
      {
        "id": "T-14",
        "name": "Claude Code plugin",
        "status": "In Progress",
        "mscw": "Must",
        "subtasks": [
          {
            "id": "T-15",
            "name": "Plugin manifest and marketplace",
            "status": "Complete",
            "mscw": "Must"
          },
          {
            "id": "T-16",
            "name": "Hooks harness with off, warn and enforce",
            "status": "Complete",
            "mscw": "Must"
          },
          {
            "id": "T-17",
            "name": "Skills and agents",
            "status": "Complete",
            "mscw": "Must"
          },
          {
            "id": "T-18",
            "name": "Start the live plan branch for this repo",
            "status": "Complete",
            "mscw": "Must",
            "description": "Run mvplan init --from plan.json, then remove plan.json from main.",
            "acceptance": [
              {
                "text": "mvplanner/plan exists on GitHub",
                "done": true
              },
              {
                "text": "plan.json is removed from main",
                "done": true
              }
            ],
            "log": [
              {
                "at": "2026-10-22T22:38:51.898Z",
                "agent": "claude-pr4",
                "text": "Claimed on claude/project-thread-mr24nb"
              },
              {
                "at": "2026-10-22T22:38:54.239Z",
                "agent": "claude-pr4",
                "text": "checked \"mvplanner/plan exists on GitHub\"; linked https://github.com/sirashton/MVPlanner/pull/4; Created mvplanner/plan from plan.json with Alex's go-ahead; PR #4 removes plan.json from main"
              },
              {
                "at": "2026-10-22T22:41:28.749Z",
                "agent": "claude-pr4",
                "text": "status In Progress -> Complete; checked \"plan.json is removed from main\"; PR #4 merged; plan.json removed from main"
              }
            ],
            "links": [
              "https://github.com/sirashton/MVPlanner/pull/4"
            ]
          },
          {
            "id": "T-19",
            "name": "Try it in real Claude Code sessions",
            "status": "Complete",
            "mscw": "Must",
            "acceptance": [
              {
                "text": "Installs from the marketplace in a fresh session",
                "done": true
              },
              {
                "text": "Two agents in different projects pick different tasks without talking",
                "done": true
              }
            ],
            "log": [
              {
                "at": "2026-10-22T23:41:10.211Z",
                "agent": "claude-panel",
                "text": "Dry run 2026-10-22 in the cloud container: installed mvplanner@mvplanner from the GitHub marketplace; two headless sessions in separate clones of a shared remote, started at the same moment, claimed T-2 and T-3 (the second saw the first's claim and moved on). Left open for Alex to try on his own machine."
              },
              {
                "at": "2026-10-23T00:14:41.615Z",
                "agent": "claude-5f5428c4",
                "text": "Claimed on claude/project-thread-mr24nb"
              },
              {
                "at": "2026-10-23T02:38:54.782Z",
                "agent": "claude-5f5428c4",
                "text": "status In Progress -> Complete; checked \"Installs from the marketplace in a fresh session\"; checked \"Two agents in different projects pick different tasks without talking\"; Alex agreed this counts (2026-10-23). Handoff: a fresh cloud session installed the plugin through the environment setup script and got the briefing. On 2026-10-23 a second project (agent claude-167688b6) and this one worked from the plan at the same time and never claimed the same task: 7 PRs (#9 to #15), all merged. Gotchas found: agents mark a task complete when the PR opens, not when it merges, and parallel PRs clash on the rebuilt plugin/dist bundle, so each needs a rebuild after the one before it merges. Left out: a test on Alex's own Windows machine."
              }
            ]
          },
          {
            "id": "T-44",
            "name": "Distinct agent ids for sessions started from inside another session",
            "status": "Complete",
            "mscw": "Must",
            "description": "A claude process launched from inside another Claude Code session inherits its session id, so both get the same agent id and the second can re-claim the first's task. Seen in the T-19 dry run. Add something unique per process, or detect the inherited id.",
            "log": [
              {
                "at": "2026-10-22T23:41:12.537Z",
                "agent": "claude-panel",
                "text": "Proposed under T-14"
              },
              {
                "at": "2026-10-23T00:14:39.118Z",
                "text": "Proposal accepted"
              },
              {
                "at": "2026-10-23T00:50:37.253Z",
                "agent": "claude-5f5428c4",
                "text": "Claimed on claude/project-thread-mr24nb"
              },
              {
                "at": "2026-10-23T00:53:28.207Z",
                "agent": "claude-5f5428c4",
                "text": "linked https://github.com/sirashton/MVPlanner/pull/9; PR #9 open. The first live process to use a session id owns it; nested processes get a -p<pid> suffix; resumed sessions keep their id. Merging when CI is green."
              },
              {
                "at": "2026-10-23T00:53:56.639Z",
                "agent": "claude-5f5428c4",
                "text": "status In Progress -> Complete; Merged in PR #9. Handoff: nested claude processes share the parent's session_id and transcript path, and only CLAUDE_PID differs. Ownership records live in CLAUDE_PLUGIN_DATA/sessions/owners/<session>.json. Without CLAUDE_PID, behaviour is unchanged."
              }
            ],
            "links": [
              "https://github.com/sirashton/MVPlanner/pull/9"
            ]
          },
          {
            "id": "T-45",
            "name": "Enforce claims by default in new plans",
            "status": "Complete",
            "mscw": "Must",